{
  "decision_id": "dec-fixture-001",
  "exchange": "binance",
  "account_id": "main",
  "symbol": "ETHUSDT",
  "direction_intent": "long",
  "confidence": {"level": "medium", "score": 0.67},
  "decision_confidence": {"level": "medium", "score": 0.67},
  "cross_horizon_policy": {"suggested_policy": "reduce_risk"},
  "risk_hints": {"market_fragility": "medium"},
  "trace_id": "trace-fixture-001"
}
